{
  "schemaVersion": "1.0",
  "name": "contact_form",
  "title": "Contact us",
  "description": "We'd love to hear from you.",
  "settings": {
    "displayMode": "single",
    "confirmationMessage": "Thanks! We'll be in touch."
  },
  "pages": [
    {
      "name": "main",
      "elements": [
        { "type": "text", "name": "full_name", "label": "Your name", "required": true },
        { "type": "email", "name": "email", "label": "Email", "required": true },
        {
          "type": "single_choice",
          "name": "topic",
          "label": "What is this about?",
          "options": [
            { "value": "support", "label": "Support" },
            { "value": "sales", "label": "Sales" },
            { "value": "other", "label": "Something else" }
          ]
        },
        {
          "type": "longtext",
          "name": "message",
          "label": "Message",
          "placeholder": "Tell us more…",
          "required": true,
          "validation": { "maxLength": 2000 }
        }
      ]
    }
  ]
}
